{
  "$schema": "https://json-schema.org/draft/2020-12/schema",
  "$id": "https://aidazi.framework/schemas/framework-capabilities.schema.json",
  "title": "Framework capability contract (Phase-4 native-E2E, design §2/§13)",
  "description": "Machine-readable, framework-OWNED declaration of the capabilities the DEPLOYED aidazi provides. Preflight (--sign-plan) and the real-run gate check charter.required_framework_capabilities against this contract DETERMINISTICALLY + FAIL-CLOSED (a missing/under-versioned/malformed/unreadable contract REFUSES). Capability IDENTITY is anchored to CODE (each capability names a code_anchor a build-time test resolves), so it does NOT depend only on mutable documentation text.",
  "type": "object",
  "required": ["contract_version", "framework_version", "capabilities"],
  "additionalProperties": false,
  "properties": {
    "$schema_ref": {"type": "string", "description": "Informational pointer to this schema (relative repo path)."},
    "contract_version": {"type": "string", "minLength": 1, "description": "Schema/contract revision of THIS file's shape."},
    "framework_version": {"type": "string", "minLength": 1, "description": "The deployed aidazi framework version, surfaced in a capability refusal so the adopter knows what they pinned."},
    "capabilities": {
      "type": "array",
      "description": "The capabilities this framework build PROVIDES. An adopter references these ids in charter.required_framework_capabilities.",
      "items": {
        "type": "object",
        "required": ["id", "version", "code_anchor"],
        "additionalProperties": false,
        "properties": {
          "id": {"type": "string", "minLength": 1, "pattern": "^[a-z][a-z0-9_]*$", "description": "Stable capability id (snake_case)."},
          "version": {"type": "string", "pattern": "^[0-9]+(\\.[0-9]+)*$", "description": "Capability version (dotted integers, compared component-wise vs an adopter's min_version)."},
          "code_anchor": {"type": "string", "pattern": "^[^:]+:[^:]+$", "minLength": 3, "description": "<repo-relative-path>:<symbol> — the def/class that PROVES the capability is wired in code (identity is code-anchored, not doc text)."},
          "summary": {"type": "string", "description": "One-line human summary (advisory; NOT the identity — the code_anchor is)."}
        }
      }
    }
  }
}
